{
  "id": "Caleul/lilka-catalog-e2e/agent/catalog-e2e-writer",
  "name": "Catalog E2E Writer",
  "description": "Synthetic writer for catalog lifecycle validation.",
  "type": "agent",
  "source": {
    "kind": "github",
    "owner": "Caleul",
    "repo": "lilka-catalog-e2e",
    "ref": "c54f2bde4b9e4e75c750bd29c86b46765b1575cb",
    "path": "packages/agent/catalog-e2e-writer/1.0.0",
    "format": "auto"
  },
  "digest": "sha256:e64d162c571285ed9fa17d844f0a267186b3523dd558242525948288fe975f36",
  "version": "1.0.0",
  "downloads": 0,
  "tags": [],
  "publishedAt": "2026-09-09T11:13:22.509Z",
  "license": "MIT"
}
