{
  "id": "Caleul/lilka-catalog-e2e/theme/catalog-e2e-theme",
  "name": "Catalog E2E Theme",
  "description": "Synthetic theme for catalog lifecycle validation.",
  "type": "theme",
  "source": {
    "kind": "github",
    "owner": "Caleul",
    "repo": "lilka-catalog-e2e",
    "ref": "55ce20bf55db6bf43117bc8a01568da225bb0437",
    "path": "packages/theme/catalog-e2e-theme/1.0.0",
    "format": "auto"
  },
  "digest": "sha256:af5c34f8e5401aa925252250d4566710b1e28ed953f338e63a6fc590063581d1",
  "version": "1.0.0",
  "downloads": 0,
  "tags": [],
  "publishedAt": "2026-09-09T11:11:31.750Z",
  "license": "MIT"
}
